{
  "schema_version": "1.0.0",
  "request_id": "mock-003",
  "image": {"image_id": null, "file_name": "example_multiple.jpg", "width": 1920, "height": 1080},
  "pipeline": {"mode": "mock", "detector_id": "mock-detector", "classifier_id": "mock-classifier", "class_map_version": "swg-v1", "detector_threshold": 0.5, "review_threshold": 0.7},
  "status": "needs_review",
  "needs_review": true,
  "detections": [
    {"detection_id": "d1", "bbox_xywh": [100, 250, 700, 600], "detector_score": 0.96,
     "top_k": [{"class_id": 7, "label": "eurasian_wild_pig", "score": 0.91}, {"class_id": 2, "label": "sambar", "score": 0.04}, {"class_id": 0, "label": "large_antlered_muntjac", "score": 0.03}]},
    {"detection_id": "d2", "bbox_xywh": [1000, 500, 300, 350], "detector_score": 0.76,
     "top_k": [{"class_id": 1, "label": "annamite_striped_rabbit", "score": 0.55}, {"class_id": 4, "label": "common_palm_civet", "score": 0.25}, {"class_id": 5, "label": "masked_palm_civet", "score": 0.12}]}
  ],
  "error": null,
  "elapsed_ms": 0
}
